{
  "schemaVersion": 1,
  "command": "init",
  "mode": "dry_run",
  "status": "success",
  "exitCode": 0,
  "detections": [
    {
      "harness": "claude-code",
      "state": "project",
      "evidence": [
        {
          "origin": "project",
          "kind": "config",
          "value": ".claude/settings.json"
        },
        {
          "origin": "project",
          "kind": "directory",
          "value": ".claude"
        }
      ],
      "selectedExplicitly": false,
      "version": null,
      "versionSource": null
    }
  ],
  "plan": {
    "schemaVersion": 1,
    "projectRoot": "C:\\Users\\Admin\\AppData\\Local\\Temp\\claude\\D--MyProjects-ContextBrake\\c30cb916-4ed9-4032-b3fa-d81dfd756e24\\scratchpad\\qa02-runs\\ps-plain-f0b04294",
    "changes": [
      {
        "path": ".claude/hooks/context-brake-statusline.mjs",
        "realPath": "C:/Users/Admin/AppData/Local/Temp/claude/D--MyProjects-ContextBrake/c30cb916-4ed9-4032-b3fa-d81dfd756e24/scratchpad/qa02-runs/ps-plain-f0b04294/.claude/hooks/context-brake-statusline.mjs",
        "kind": "create",
        "owner": "runtime_asset",
        "beforeSha256": null,
        "afterSha256": "a4e86928fa76ca4ac47ef912b3f04c8f3aa984b36a5071f3dbd164b7a37e2afa",
        "preview": {
          "summary": "Install the status line bridge script"
        }
      },
      {
        "path": ".claude/hooks/context-brake.mjs",
        "realPath": "C:/Users/Admin/AppData/Local/Temp/claude/D--MyProjects-ContextBrake/c30cb916-4ed9-4032-b3fa-d81dfd756e24/scratchpad/qa02-runs/ps-plain-f0b04294/.claude/hooks/context-brake.mjs",
        "kind": "create",
        "owner": "runtime_asset",
        "beforeSha256": null,
        "afterSha256": "0919e350e2541e90c90a130640d52f7d40893cde2da5b6e01f6ea875cf4e1643",
        "preview": {
          "summary": "Install ContextBrake hook script"
        }
      },
      {
        "path": ".claude/settings.json",
        "realPath": "C:/Users/Admin/AppData/Local/Temp/claude/D--MyProjects-ContextBrake/c30cb916-4ed9-4032-b3fa-d81dfd756e24/scratchpad/qa02-runs/ps-plain-f0b04294/.claude/settings.json",
        "kind": "update",
        "owner": "harness_entry",
        "beforeSha256": "78922a784ee78e9e50587e93628cd3b9d4dfbe49087adc4514e6781cea38cbb9",
        "afterSha256": "f762e52cf3a23c36b168128fc229ecc9ced0b3975468b7daec2f2e7fff2c91fd",
        "preview": {
          "summary": "Register Claude Code hooks"
        }
      },
      {
        "path": ".claude/settings.local.json",
        "realPath": "C:/Users/Admin/AppData/Local/Temp/claude/D--MyProjects-ContextBrake/c30cb916-4ed9-4032-b3fa-d81dfd756e24/scratchpad/qa02-runs/ps-plain-f0b04294/.claude/settings.local.json",
        "kind": "create",
        "owner": "harness_entry",
        "beforeSha256": null,
        "afterSha256": "f4e201920dfe17d80ba5967ca23db1519f0851cf2549e7f111002606e220a3c5",
        "preview": {
          "summary": "Install the status line bridge; no previous status line existed"
        }
      },
      {
        "path": ".context-brake/manifest.json",
        "realPath": "C:/Users/Admin/AppData/Local/Temp/claude/D--MyProjects-ContextBrake/c30cb916-4ed9-4032-b3fa-d81dfd756e24/scratchpad/qa02-runs/ps-plain-f0b04294/.context-brake/manifest.json",
        "kind": "create",
        "owner": "manifest",
        "beforeSha256": null,
        "afterSha256": "97735ed0175dd18cc2d71a6bcb64c4d80e81099fed23d5f6e5fd6b8c959f1241",
        "preview": {
          "summary": "Record installation manifest with managed assets and entries"
        }
      },
      {
        "path": ".context-brake/runtime/claude-statusline.json",
        "realPath": "C:/Users/Admin/AppData/Local/Temp/claude/D--MyProjects-ContextBrake/c30cb916-4ed9-4032-b3fa-d81dfd756e24/scratchpad/qa02-runs/ps-plain-f0b04294/.context-brake/runtime/claude-statusline.json",
        "kind": "update",
        "owner": "harness_entry",
        "beforeSha256": null,
        "afterSha256": "f57c3d8a5ce4161c3d9f831423050113f12d17d45c61f97ca42ccbdd8a224168",
        "preview": {
          "summary": "Record the status line bridge state"
        }
      },
      {
        "path": ".gitignore",
        "realPath": "C:/Users/Admin/AppData/Local/Temp/claude/D--MyProjects-ContextBrake/c30cb916-4ed9-4032-b3fa-d81dfd756e24/scratchpad/qa02-runs/ps-plain-f0b04294/.gitignore",
        "kind": "update",
        "owner": "gitignore",
        "beforeSha256": "853bdb9e4c430bb46f05289d0d2c37d6b99128f78ab80d4fa929c50af733be90",
        "afterSha256": "fdbdb3a858673755ad5a3212ebcd2802d88f9d98b8ddee6f0f9d267d7a93a780",
        "preview": {
          "summary": "Keep ContextBrake's files out of Git"
        }
      },
      {
        "path": "context-brake.config.json",
        "realPath": "C:/Users/Admin/AppData/Local/Temp/claude/D--MyProjects-ContextBrake/c30cb916-4ed9-4032-b3fa-d81dfd756e24/scratchpad/qa02-runs/ps-plain-f0b04294/context-brake.config.json",
        "kind": "create",
        "owner": "config",
        "beforeSha256": null,
        "afterSha256": "1d047837e0293cd98aa0d5db7fd56a0064233352fdd3e07612be2b86aa158047",
        "preview": {
          "summary": "Configure ContextBrake active harnesses and zones; no snapshot command, so only zone headers will be injected (trigger: RED)"
        }
      }
    ],
    "conflicts": [],
    "harnesses": [
      {
        "harness": "claude-code",
        "outcome": "planned",
        "supportLevel": "full",
        "limitations": [
          {
            "capability": "context_usage",
            "impact": "Read from the session transcript, whose format is undocumented; falls back to an estimate. The context window comes from the status line bridge, which init installs by default; without it, the window falls back to contextWindowCeiling."
          },
          {
            "capability": "auto_restart",
            "impact": "Opt-in through init --auto-restart; needs Claude Code 2.1.287 or later with mods enabled. Run doctor to check that the mod loads."
          }
        ]
      }
    ],
    "requiresConfirmation": true
  },
  "outcomes": [],
  "findings": []
}
